56d21c3ae7d4791d0090264f,بدھ مت,اگرچہ بدھ مت سے پہلے کی ابتدائی برہمنی تحریروں میں &quot;مراقبہ&quot; کا کوئی زبردست ثبوت نہیں ہے، وائن کا دعویٰ ہے کہ اپنشدک کائناتی دعووں اور بدھ کے دو سرپرستوں کے مراقبہ کے مقاصد کے درمیان نمایاں مماثلت کی وجہ سے، بے ترتیب مراقبہ برہمنی یا شرمانی نسب سے نکلا ہے۔ قدیم بدھ متوں میں ذکر کیا گیا ہے۔ وہ کم ممکنہ اختیارات پر بھی بات کرتا ہے۔ یہ ثابت کرنے کے بعد کہ اپنشدوں میں کائناتی تبصرے بھی اسی طرح ایک عکاس روایت کا مظاہرہ کرتے ہیں، وہ دعویٰ کرتے ہیں کہ نسادیہ سکتہ ایک مراقبہ کی روایت کے اشارے پیش کرتا ہے، جیسا کہ بعد کے رگ ویدک دور کے اوائل میں تھا۔,بدھ مت سے پہلے ابتدائی برہمنی متون میں، کیا ثبوت کی کمی ہے؟,مراقبہ,False
56d21fd7e7d4791d00902673,بدھ مت,سیلا (سنسکرت میں) یا سیلا (پالی میں) کو اکثر انگریزی میں نیک سلوک، اخلاقیات، اخلاقی نظم و ضبط، اخلاقیات، یا رہنما خطوط سے تعبیر کیا جاتا ہے۔ یہ ایک ایسا عمل ہے جو جسم، تقریر، یا دماغ کے ذریعے کیا جاتا ہے، اور اس کے لیے جان بوجھ کر کوشش کی ضرورت ہوتی ہے۔ یہ تین طریقوں (سیلا، سمادھی اور پنہ) میں سے ایک کی نمائندگی کرتا ہے اور دوسرا &quot;پارامیتا&quot; ہے۔ یہ سوچ، الفاظ اور اعمال میں اخلاقی وضاحت کی نشاندہی کرتا ہے۔ شیلا کی چار شرطیں عفت، سکون، خاموشی اور بندگی ہیں۔,سیلا کس چیز کا دوسرا ہے؟,پارلیمنٹ,False
56d2207ee7d4791d0090268f,بدھ مت,شیلا سمادھی/بھاونا (مراقبہ ترقی) یا ذہنی تطہیر کے سنگ بنیاد کے طور پر کام کرتی ہے۔ اصولوں پر عمل پیرا ہونا نہ صرف پریکٹیشنر کے اندرونی سکون کو فروغ دیتا ہے بلکہ کمیونٹی کے اندر ہم آہنگی میں بھی حصہ ڈالتا ہے، جو کہ بیرونی ہے۔ کرما کے قانون کے مطابق، &quot;&quot; اصولوں پر عمل کرنا&quot; نیکی ہے اور پرامن اور خوشگوار نتائج کے لیے ایک اتپریرک کے طور پر کام کرتا ہے۔ ان اصولوں کا مشاہدہ عمل کرنے والے کو وجود کے چار بدقسمت دائروں میں دوبارہ جنم لینے سے روکتا ہے۔,کیا چیز ذہنی سکون کے ساتھ ساتھ معاشرے میں ہم آہنگی کو فروغ دیتی ہے؟,احکام کو برقرار رکھنا,False
56d24217b329da140004ec8a,بدھ مت,سمتھا مراقبہ کسی چیز یا تصور کے بارے میں آگاہی کے ساتھ شروع ہوتا ہے، جو کسی کے جسم، دماغ اور پورے ماحول کو گھیرنے کے لیے وسیع کیا جاتا ہے، جس کے نتیجے میں مکمل توجہ اور سکون کی حالت (جھنا) ہوتی ہے۔ مراقبہ کے نقطہ نظر میں متعدد تغیرات ہیں، جن میں ٹانگوں کے بل بیٹھنے یا گھٹنے ٹیکنے سے لے کر جاپ کرنے یا چلنے تک شامل ہیں۔ مراقبہ کی سب سے زیادہ مروجہ تکنیک اپنی سانسوں پر توجہ مرکوز کرنا ہے (اناپاناستی)، کیونکہ یہ مشق سماتھا اور وپاسنا دونوں کا باعث بن سکتی ہے۔,سمتھا مراقبہ کسی چیز کے بارے میں آگاہی سے شروع ہوتا ہے یا کیا؟,خیال,False
56d25056b329da140004ed51,بدھ مت,قدیم ترین تعلیمات سے متعلق ڈیٹا ابتدائی نسخوں کی جانچ کے ذریعے حاصل کیا جا سکتا ہے۔ بدھ مت کے قدیم ترین بنیادی اصولوں کے بارے میں معلومات اکٹھا کرنے کی ایک تکنیک میں تھیراوادین پالی کینن کے قدیم ترین نسخوں کو دوسری تحریروں سے متصادم کرنا شامل ہے۔ ان وسائل کی انحصاریت، نیز قدیم ترین تعلیمات کی بنیاد نکالنے کی صلاحیت، تنازعہ کا موضوع ہے۔ ویٹر تجویز کرتا ہے کہ تضادات برقرار رہتے ہیں، ان تضادات کو دور کرنے کے لیے متبادل طریقوں کے استعمال کی ضرورت ہے۔,تعلیمات کے بنیادی اصولوں کی تحقیقات کے بارے میں کیا متنازعہ ہے؟,وشوسنییتا,False
56d25b1c59d6e41400145eea,بدھ مت,ابتدائی بدھ مت کے امتحان میں ایک بنیادی مسئلہ دھیان اور بصیرت کے درمیان تعلق ہے۔ شمتھاؤسن، ابتدائی بدھ مت میں &#39;آزادی بصیرت&#39; اور &#39;روشن خیالی&#39; کے بیانات یا نظریات کے کچھ پہلوؤں پر اپنے اکثر حوالہ جات والے مضمون میں مشاہدہ کرتا ہے کہ آزاد بصیرت کی تشکیل کے طور پر چار عظیم سچائیوں کا حوالہ، جو روپا جھانس میں مہارت حاصل کرنے کے بعد حاصل ہوتا ہے۔ مجہما نکایا 36 جیسی نصوص میں بعد میں اضافہ۔,ابتدائی بدھ مت کی کھوج میں ایک اہم مسئلہ دھیان کا تعلق ہے اور کون سا دوسرا تصور ہے؟,بصیرت,False
56d25ee359d6e41400145f0d,بدھ مت,بروس میتھیوز نے ریمارکس دیے ہیں کہ سوٹا پتاکا میں &quot;کرما&quot; کی کوئی متفقہ نمائندگی نہیں ہے، جس کا مطلب یہ ہو سکتا ہے کہ یہ نظریہ ابتدائی بدھ مت کے سماجیات کے بنیادی نقطہ نظر کے لیے ثانوی تھا۔ شمتھاؤسن ایک ممتاز ماہر تعلیم ہیں جنہوں نے چیلنج کیا ہے کہ کیا کرما کا پہلے سے ہی ابتدائی بدھ مت کے پنر جنم کے نظریہ میں کوئی کردار تھا۔ ویٹر کے مطابق، بدھ نے ابتدا میں بے موت (امتا/امرت) کی تلاش کی، جو موجودہ لمحے سے متعلق ہے۔ ویٹر کا مؤقف ہے کہ صرف اس تفہیم کے بعد مہاتما بدھ دوبارہ جنم لینے کے نظریے سے واقف ہو گئے تھے۔ برونکھورسٹ مختلف انداز میں دعویٰ کرتا ہے، یہ نتیجہ اخذ کرتے ہوئے کہ بدھ نے کرما کا ایک تصور متعارف کرایا جو اپنے دور کے مروجہ عقائد سے نمایاں طور پر مختلف تھا۔ برونکھورسٹ کے مطابق، یہ جسمانی اور ذہنی اعمال نہیں تھے جنہیں دوبارہ جنم لینے کا ذمہ دار سمجھا جاتا تھا، بلکہ ارادے اور خواہشات۔,برونکھورسٹ کا دعویٰ ہے کہ بدھ کا نقطہ نظر جدید نظریات سے خاص طور پر مختلف &#39;کس چیز&#39; پر تھا؟,کرما,False
56d2606959d6e41400145f1e,بدھ مت,اگرچہ نبنا (سنسکرت: &quot;نروان&quot;) اس مشق کے آرزو مند مقصد کے لیے مروجہ اصطلاح ہے، لیکن نکیاس میں متعدد دیگر تاثرات دریافت کیے جا سکتے ہیں، جن کی تفصیل نہیں ہے۔[نوٹ 35],نبنا کے سنسکرت کے برابر کیا ہے؟,نروان,False
56d26abd59d6e41400145fa2,بدھ مت,تقسیم کے بعد، ہر ایک سنگھا نے ایک &quot;ابھیدھرم&quot; اکٹھا کرنا شروع کیا، جو صوتوں میں پائے جانے والے نظریاتی مواد کی ایک پیچیدہ علمی تشریح ہے، جو منظم درجہ بندی کے مطابق ترتیب دی گئی ہے۔ یہ ابھیدھرم مسودات میں منظم فلسفیانہ گفتگو شامل نہیں ہے، بلکہ خلاصہ یا واضح فہرستیں شامل ہیں۔ محققین عام طور پر ان دستاویزات کی تاریخ تقریباً تیسری صدی قبل مسیح میں بتاتے ہیں، بدھ کے انتقال کے 100 سے 200 سال بعد نتیجتاً، سات ابھیدھرم متون میں اکثر یہ دعویٰ کیا جاتا ہے کہ وہ خود بدھ کے بیانات کی نمائندگی نہیں کرتے، بلکہ ان کے پیروکاروں اور معزز اسکالرز کے بیانات کی نمائندگی کرتے ہیں۔ متعدد اسکولوں کے مختلف ابیدھرم اکثر ایک دوسرے کے ساتھ موافق نہیں ہوتے تھے۔ مہاسنگھیکا اسکول کے اندر ایک ابھدھما پٹکا کے وجود پر ماہرین تعلیم تقسیم ہیں۔[نوٹ 38],نظریاتی مواد کی ایک پیچیدہ علمی تشریح کے لیے کیا اصطلاح ہے؟,ابھیدھرما,False
56d298dd59d6e41400146118,بدھ مت,ڈوائٹ گوڈارڈ نے 1920 کی دہائی کے دوران اپنی &#39;بدھسٹ بائبل&#39; میں تاؤ ٹی چنگ سمیت مشرقی فکر کے دیگر اہم کاموں کے ساتھ زین پر توجہ مرکوز کرتے ہوئے بدھ مت کی تحریروں کا ایک مجموعہ جمع کیا۔ حال ہی میں، ڈاکٹر باباصاحب امبیڈکر نے بدھ اور اس کے دھام میں بدھ مت کی تعلیمات کی ایک متفقہ دستاویز مرتب کرنے کی کوشش کی۔ اس طرح کے اقدامات آج تک جاری ہیں، لیکن فی الحال، کوئی واحد متن موجود نہیں ہے جس میں تمام بدھ روایات شامل ہوں۔,گوڈارڈ نے بنیادی طور پر بدھ مت کے صحیفے کی کس مخصوص شکل کو جمع کیا؟,یہ تھا,False
56d29bca59d6e4140014612c,بدھ مت,متن کے مطابق، بدھ کے انتقال کے فوراً بعد، افتتاحی بدھ کونسل ہوئی؛ مہاکاشاپہ (پالی: Mahākassapa) کے نام سے ایک راہب انچارج تھا۔ کونسل کا مقصد بدھ کی تعلیمات کو دستاویزی شکل دینا تھا۔ اپالی نے ونیا کی تلاوت کی۔ آنند، جو بدھ کے قریبی خدمتگار تھے، کو دھم کی تلاوت کے لیے مدعو کیا گیا تھا۔ انہی نے ترپیتک کی بنیاد رکھی۔ بہر حال، یہ دستاویز ابتدائی طور پر تلاوت کی شکل میں زبانی طور پر پہنچائی گئی تھی اور آخری صدی قبل مسیح میں لکھی گئی تھی۔ ہر بدھ روایت کے سوتر اور ونیا دونوں عناصر کی ایک وسیع صف کو گھیرے ہوئے ہیں جن میں دھرم پر بات چیت، دیگر تعلیمات کے تجزیے، کائناتی اور کاسموگنی سے متعلق متن، گوتم بدھ کے سابقہ وجود کی داستانیں، اور دیگر مختلف موضوعات شامل ہیں۔,بدھ کی موت کے بعد مجلس کی صدارت کس راہب نے کی؟,مہاکاشیاپا,False
56d3665c59d6e414001462e2,امریکن_آئیڈل,امریکن آئیڈل فیصلہ کنوں کے ایک گروپ کو استعمال کرتا ہے جو شرکاء کی کارکردگی کا جائزہ لیتے ہیں۔ ابتدائی ججز میوزک پروڈیوسر اور ٹیلنٹ مینیجر رینڈی جیکسن، پاپ گلوکار اور کوریوگرافر پاؤلا عبدل، اور میوزک ایگزیکٹو کے ساتھ ساتھ منیجر سائمن کوول تھے۔ تازہ ترین سیزن کے ججنگ پینل میں ملکی گلوکار کیتھ اربن، گلوکارہ اور اداکارہ جینیفر لوپیز، اور جاز پرفارمر ہیری کونک، جونیئر شامل تھے۔ پروگرام کی میزبانی سب سے پہلے ریڈیو کے میزبان ریان سیکرسٹ اور کامیڈین برائن ڈنکل مین نے کی تھی، جس کے بعد سیکرسٹ اس کے بعد کے سیزن تک جاری رہے گا۔ .,کون سا پاپ آرٹسٹ امریکن آئیڈل کے اصل ججوں میں سے ایک تھا؟,پاؤلا عبدل,False
56d36db659d6e41400146379,امریکن_آئیڈل,چیمپیئن شپس لائیو اسٹوڈیو کے سامعین کے سامنے لاس اینجلس میں واقع CBS ٹیلی ویژن سٹی سے چوٹی کے اوقات میں نشر کی جاتی ہیں۔ چیمپئن شپ کے راؤنڈ پہلے سیزن میں آٹھ ہفتوں تک، اگلے سیزن میں گیارہ ہفتے سیزن دس اور گیارہ تک بڑھے جو بارہ ہفتوں پر محیط تھے، سیزن بارہ کے علاوہ، جو دس ہفتوں تک چلا، اور سیزن تیرہ، جو تیرہ ہفتوں تک جاری رہا۔ ہر فائنلسٹ ایک ہفتہ وار تھیم کے ساتھ منسلک گانوں کی پرفارمنس پیش کرتا ہے جو کہ موٹاون، ڈسکو، یا بڑا بینڈ جیسا میوزیکل زمرہ ہو سکتا ہے، مائیکل جیکسن، ایلوس پریسلی، یا دی بیٹلز جیسے فنکاروں کی دھنیں، یا وسیع تر تھیمز جیسے بل بورڈ نمبر 1 ہٹ۔ یا مدمقابل کی پیدائش کے سال کے گانے۔ مقابلہ کرنے والے عام طور پر تھیم سے منسلک مشہور شخصیت کے سرپرست کے ساتھ تعاون کرتے ہیں۔ سیزن ٹین میں، جمی آئیوین کو اس سیزن کے لیے ایک سرپرست کے طور پر متعارف کرایا گیا تھا۔ سب سے پہلے، مقابلہ کرنے والے ہر ہفتے ایک گانا پیش کرتے ہیں، لیکن اس کو بڑھا کر ٹاپ چار یا پانچ سے دو گانوں تک، پھر ٹاپ دو یا تین کے لیے تین گانے۔,امریکن آئیڈل کے دسویں سیزن کے دوران سرپرست کے طور پر کس نے خدمات انجام دیں؟,جمی آئیوائن,False
56db031de7c41114004b4c42,امریکن_آئیڈل,"سیزن کا اختتام سیزن کا دو گھنٹے کا اختتامی ایپیسوڈ ہے، جس کا اختتام فاتح کے اعلان پر ہوتا ہے۔ ایک، تین سے چھ اور چودہ سیزن کے لیے، اسے ڈولبی تھیٹر سے نشر کیا گیا، جس میں تقریباً &quot;3,400&quot; افراد کے بیٹھنے کی گنجائش ہے۔ دوسرے سیزن کا فائنل گبسن ایمفی تھیٹر میں ہوا، جس میں بیٹھنے کی گنجائش 6,000 سے زیادہ تھی۔ سات سے تیرہ سیزن میں، مقام نوکیا تھیٹر تھا، جس میں 7,000 سے زیادہ سامعین موجود تھے۔",ڈولبی تھیٹر کے سامعین کی گنجائش کتنی ہے؟,"3,400",False
56d3702e59d6e414001463b1,امریکن_آئیڈل,ابتدائی دو سیزن کے علاوہ، سیمی فائنل اور اس کے بعد کے مدمقابل اسٹوڈیو کے سامعین کے سامنے اپنی صلاحیتوں کا مظاہرہ کرتے ہیں۔ فائنل کے دوران ان کے ساتھ مکمل بینڈ ہوتا ہے۔ چوتھے سیزن سے لے کر نویں تک، امریکن آئیڈل بینڈ کا انعقاد رکی مائنر نے کیا۔ سیزن دس کے بعد، رے چیو نے اقتدار سنبھال لیا۔ مزید برآں، مائیکل آرلینڈ اور ڈیبرا برڈ سمیت آواز کے کوچز اور گانا ترتیب دینے والے، پردے کے پیچھے مقابلہ کرنے والوں کی مدد کر سکتے ہیں۔ سیزن سات کے بعد سے، مقابلہ کرنے والوں کو ہالی ووڈ راؤنڈز کے بعد موسیقی کے آلے کے ساتھ پرفارم کرنے کا موقع ملتا ہے۔ پہلے نو سیزن کے دوران، پرفارمنس عام طور پر منگل کی شام کو براہ راست نشر ہوتی ہیں، اس کے بعد ریاستہائے متحدہ اور کینیڈا دونوں میں بدھ کو نتائج دکھائے جاتے ہیں، لیکن سیزن دس میں، شیڈول بدھ اور جمعرات کو منتقل ہو گیا۔,جمعرات کی شام کو کس سیزن میں امریکن آئیڈل کی نشریات کا آغاز ہوا؟,دس,False
56d370aa59d6e414001463c2,امریکن_آئیڈل,"آڈیشن کے مراحل کے دوران، تقریباً 10,000 میں سے 121 شرکاء کا انتخاب کیا گیا جو آڈیشن میں آئے تھے۔ یہ تعداد سیمی فائنل کے لیے کم کر کے 30 کر دی گئی، دس فائنل میں آگے بڑھنے کے ساتھ سیمی فائنل کے ایک مدمقابل، ڈیلانو کیگنولاٹی، کو شو کی عمر کی پابندی کو نظرانداز کرنے کے لیے دھوکہ دہی کے لیے مقابلے سے ہٹا دیا گیا تھا۔ ایک ابتدائی پسندیدہ، تمیرا گرے، کو ٹاپ فور میں خارج کر دیا گیا تھا، جو مستقبل کے سیزن میں ہونے والے متعدد حیران کن خاتمے کے آغاز کی نشاندہی کرتا ہے۔ کرسٹینا کرسچن کو سینے میں تکلیف اور دل کی دھڑکن کی وجہ سے ٹاپ چھ کے نتائج نشر ہونے سے پہلے ہی ہسپتال میں داخل ہونا پڑا، اور جب وہ طبی سہولت میں تھیں تو انہیں نکال دیا گیا۔ Jim Verraros پروگرام میں کھلے عام ہم جنس پرستوں کا پہلا مقابلہ کرنے والا تھا۔ اس کے جنسی رجحان کا انکشاف اس کی آن لائن ڈائری میں کیا گیا تھا، حالانکہ اسے شو کے پروڈیوسروں کی درخواست کے بعد مقابلے کے دوران ہٹا دیا گیا تھا کیونکہ ان خدشات کی وجہ سے کہ اس سے ووٹنگ پر اثر پڑ سکتا ہے۔",کرسٹینا کرسچن مقابلے سے باہر ہونے کے وقت کہاں موجود تھی؟,ہسپتال,False
56db0b29e7c41114004b4cbc,امریکن_آئیڈل,پروگرام کے بعد دونوں حریفوں نے کامیابیاں حاصل کیں، لیکن ایکن نے اسٹڈارڈ کے فاتح گانے فلائنگ ودآؤٹ وِنگز کو اس کے بعد کے البم ریلیز کے ساتھ شو اس دی نائٹ سے اپنے سنگل لانچ کے ساتھ پیچھے چھوڑ دیا۔ چوتھے مقام کے مدمقابل جوش گراسین نے بھی ملکی موسیقار کے طور پر کامیابی کا ایک پیمانہ تجربہ کیا۔,آئیکن کے ریلیز ہونے والے سنگل کا ٹائٹل کیا تھا؟,یہ رات ہے۔,False
56d3772859d6e4140014649a,امریکن_آئیڈل,چیمپیئن شپ کے دوران، امریکن آئیڈل نے 11 مارچ 2008 کو ایک نیا ایڈوانس سیٹ اور اسٹیج پیش کیا، اس کے ساتھ ایک تازہ آن اسکرین جمالیاتی بھی۔ ٹاپ ٹین نائٹ پر ڈیوڈ کک کی بلی جین کی پیش کش کو ججوں نے سراہا، لیکن اس نے تنازعہ کو جنم دیا جب انہوں نے بظاہر کرس کارنیل کے انتظامات کو ڈیوڈ کک کا اپنا ہونے کے لیے غلط منسوب کیا، حالانکہ کارکردگی کو کارنیل کی تشریح کے طور پر پیش کیا گیا تھا۔ کارنیل نے خود تبصرہ کیا کہ وہ &#39;اعزاز&#39; تھے اور ڈیوڈ کک کے ڈسپلے کی تعریف کی۔ ٹاپ نائن پرفارمنس شو کے بعد ڈیوڈ کک کو دل کی دھڑکن اور بلڈ پریشر بڑھنے کی وجہ سے ہسپتال لے جایا گیا۔,امریکن آئیڈل کا فائنل شروع ہونے کی تاریخ کیا تھی؟,11 مارچ 2008,False
56d3772859d6e41400146497,امریکن_آئیڈل,فائنل کے لیے، امریکن آئیڈل نے 11 مارچ 2008 کو ایک جدید سیٹ اور اسٹیج کی نقاب کشائی کی، جس کے ساتھ ایک تازہ آن ایئر ڈیزائن بھی تھا۔ ٹاپ ٹین نائٹ پر ڈیوڈ کک کی بلی جین کی پیش کش کو ججوں کی طرف سے پذیرائی ملی، پھر بھی اس نے تنازعہ کو جنم دیا جب انہوں نے بظاہر کرس کارنیل کے انتظام کو ڈیوڈ کک کے اپنے ہونے کے طور پر الجھایا، اس کے باوجود کہ کارکردگی کو کارنیل کے ورژن کے طور پر واضح طور پر شناخت کیا گیا ہے۔ کارنیل نے خود اظہار کیا کہ وہ &#39;اعزاز&#39; ہیں اور ڈیوڈ کک کی کارکردگی کو سراہتے ہیں۔ ٹاپ نائن پرفارمنس شو کے بعد ڈیوڈ کک کو دل کی دھڑکن اور بلند فشار خون کی وجہ سے ہسپتال لے جایا گیا۔,ڈیوڈ کک نے ٹاپ ٹین ہفتے کے دوران امریکن آئیڈل پر کون سا ٹریک پرفارم کیا؟,بلی جین,False
56d37c5a59d6e41400146504,امریکن_آئیڈل,آخری دو حریف Lee DeWyze اور Bowersox تھے۔ DeWyze کا اعلان 26 مئی کو فائنل کے دوران فاتح کے طور پر کیا گیا۔ اس سال، فتح کے ترانے کے طور پر کوئی نیا گانا استعمال نہیں کیا گیا۔ اس کے بجائے، دونوں فائنلسٹوں میں سے ہر ایک نے کور ٹریک پیش کیا -- DeWyze نے U2 کا خوبصورت دن منتخب کیا، جبکہ Bowersox نے Patty Griffin&#39;s Up to the Mountain کا انتخاب کیا۔ یہ ابتدائی سیزن کی نشاندہی کرتا ہے جہاں کسی بھی فائنلسٹ نے قابل ذکر البم کی فروخت حاصل نہیں کی۔,امریکن آئیڈل پر فتح کے بعد لی ڈی وائز نے کون سا U2 ٹریک جاری کیا؟,خوبصورت دن,False
56db275ae7c41114004b4e3c,امریکن_آئیڈل,حریفوں کی آخری جوڑی Lee DeWyze اور Bowersox تھے۔ DeWyze کو 26 مئی کے اختتام کے دوران چیمپئن کے طور پر اعلان کیا گیا تھا۔ اس سال، کوئی نیا ٹریک فتح کے گیت کے طور پر استعمال نہیں کیا گیا۔ اس کے بجائے، دونوں فائنلسٹوں نے ایک کور ورژن جاری کیا -- ڈی وائز نے U2 کے خوبصورت دن کا انتخاب کیا، جب کہ Bowersox نے Patty Griffin&#39;s Up to the Mountain کو منتخب کیا۔ یہ افتتاحی سیزن کی نشاندہی کرتا ہے جہاں کسی بھی فائنلسٹ نے قابل ذکر البم کی فروخت حاصل نہیں کی۔,اختتام کس تاریخ کو ہوا؟,مئی-26,False
56d37ccd59d6e4140014650d,امریکن_آئیڈل,شو کے دسویں سیزن کا آغاز 19 جنوری 2011 کو ہوا۔ اس سیزن میں ڈھانچے سے لے کر پروگرام کی کاسٹ تک متعدد تبدیلیاں کی گئیں۔ جینیفر لوپیز اور اسٹیون ٹائلر نے سائمن کوول کے اخراج کے بعد رینڈی جیکسن کے ججز کے طور پر شمولیت اختیار کی دی ایکس فیکٹر کی موافقت، کارا ڈیو گارڈی (جن کے معاہدے میں توسیع نہیں کی گئی تھی)، اور ایلن ڈی جینریز، جبکہ نائجل لیتھگو ایگزیکٹو پروڈیوسر کے طور پر واپس آئے۔ جمی آئیوین، انٹرسکوپ گیفن اے اینڈ ایم لیبل گروپ کے سربراہ، امریکن آئیڈل کے نئے ساتھی، نے معمول کے ہفتہ وار مہمان مشیروں کے بجائے اندرون خانہ سرپرست کے طور پر خدمات انجام دیں، حالانکہ بعد کی اقساط میں بیونسے، will.i.am جیسے خصوصی مہمان مشیر شامل تھے۔ ، اور لیڈی گاگا۔,امریکن آئیڈل کے دسویں سیزن کے دوران ایگزیکٹو پروڈیوسر کے طور پر کس نے خدمات انجام دیں؟,نائجل لیتھگو,False
56db2880e7c41114004b4e5a,امریکن_آئیڈل,دسویں سیزن میں ڈیجیٹل ٹرائی آؤٹ کی ابتدائی شمولیت کی نشاندہی کی گئی ہے، جس سے شرکاء کو &quot;Myspace&quot; کے ذریعے 40 سیکنڈ کا ویڈیو آڈیشن بھیجنے کی اجازت ملتی ہے۔ دعویداروں میں سے ایک کیرن روڈریگز نے آخری مراحل میں جگہ بنائی۔,کس پلیٹ فارم میں شرکاء ویڈیو آڈیشن بھیج سکتے ہیں؟,مائی اسپیس,False
