56e78f3100c9c71400d772bf,نیشنل_آرکائیوز_اور_ریکارڈز_انتظامیہ,لائبریریاں اور عجائب گھر مختلف دیگر صدور کے لیے بنائے گئے ہیں، پھر بھی وہ NARA صدارتی لائبریری نیٹ ورک میں شامل نہیں ہیں، اور ان کا انتظام نجی تنظیموں، تاریخی انجمنوں، یا ریاستی حکام کے ذریعے کیا جاتا ہے، جیسے کہ ابراہم لنکن، ردرفورڈ بی کی لائبریریاں۔ ہیز، ولیم میک کینلے، ووڈرو ولسن، اور کیلون کولج مثال کے طور پر، ابراہم لنکن صدارتی لائبریری اور میوزیم ریاست الینوائے کے زیر انتظام ہے۔,کون سے سرکاری ادارے، نجی بنیادوں اور تاریخی معاشروں کے ساتھ، دوسرے صدور کے لیے قائم کی گئی لائبریریوں کی نگرانی کرتے ہیں؟,ریاستی حکومتوں,False
5a7b9cb921c2de001afea1b4,نیشنل_آرکائیوز_اور_ریکارڈز_انتظامیہ,"لائبریریاں اور گیلریاں دوسرے &quot;رہنماؤں&quot; کے لیے قائم کی گئی ہیں، لیکن ان کا تعلق NARA صدارتی لائبریری نیٹ ورک سے نہیں ہے، اور ان کا انتظام نجی فاؤنڈیشنز، تاریخی تنظیمیں، یا ریاستی انتظامیہ کرتے ہیں، بشمول ابراہم لنکن، ردرفورڈ بی ہیز۔ , William McKinley, Woodrow Wilson, and Calvin Coolidge لائبریریاں۔ مثال کے طور پر، ابراہم لنکن صدارتی لائبریری اور میوزیم ریاست الینوائے کی ملکیت اور انتظام ہے۔",تاریخی تنظیمیں کس کے لیے بنائی گئی ہیں؟,صدور,True
5a7ba34d21c2de001afea1f3,نیشنل_آرکائیوز_اور_ریکارڈز_انتظامیہ,جولائی 2007 میں، نیشنل آرکائیوز نے انکشاف کیا کہ وہ 1929 سے 1967 تک اپنی یونیورسل نیوزریلز کی ترتیب Amazon.com کی ذیلی کمپنی CreateSpace کے ذریعے فروخت کے لیے پیش کرے گا۔ انکشاف کے دوران، وائن اسٹائن نے ریمارکس دیے کہ یہ معاہدہ عام لوگوں اور نیشنل آرکائیوز کے لیے اہم فوائد کا باعث بنے گا۔ مزید برآں، انہوں نے کہا، اگرچہ عوام فلمیں دیکھنے کے لیے کالج پارک، MD میں ہماری تحقیقی سہولت کا دورہ کر سکتے ہیں اور یہاں تک کہ انہیں مفت میں نقل بھی کر سکتے ہیں، لیکن یہ نیا اقدام ان لاکھوں لوگوں تک ہمارے مجموعوں کو کافی حد تک قابل رسائی بنائے گا جو واشنگٹن، ڈی سی کے علاقے کا سفر نہیں کر سکتے۔ معاہدے میں یہ بھی شرط رکھی گئی ہے کہ CreateSpace NARA کے تحفظ پروگرام کے حصے کے طور پر نیشنل آرکائیوز کو ڈیجیٹل حوالہ اور فلموں کے تحفظ کے نقول فراہم کرنے میں تعاون کرے گا۔,کس نے CreateSpace قائم کیا اور Amazon.com کے ساتھ تعاون کرنے میں ان کی مدد کی؟,وائنسٹائن,True
56e7a8dc00c9c71400d7749a,نیشنل_آرکائیوز_اور_ریکارڈز_انتظامیہ,جولائی 2007 میں، نیشنل آرکائیوز نے اعلان کیا کہ وہ 1929 سے 1967 تک اپنے یونیورسل نیوزریلز کا مجموعہ Amazon.com کے ذیلی ادارے CreateSpace کے ذریعے فروخت کے لیے پیش کرے گا۔ اعلامیے کے دوران، وائن اسٹائن نے ریمارکس دیے کہ اس انتظام سے عام لوگوں اور نیشنل آرکائیوز کے لیے اہم فوائد حاصل ہوں گے۔ انہوں نے مزید کہا، اگرچہ عوام فلمیں دیکھنے کے لیے کالج پارک، MD میں ہماری تحقیقی سہولت کا دورہ کر سکتے ہیں اور یہاں تک کہ انہیں مفت میں نقل بھی کر سکتے ہیں، لیکن یہ نیا اقدام ان لاکھوں افراد کے لیے ہمارے مجموعے کی رسائی کو بڑھا دے گا جو واشنگٹن، ڈی سی کے علاقے کا سفر کرنے سے قاصر ہیں۔ یہ انتظام NARA کے تحفظ پروگرام کے ایک حصے کے طور پر فلموں کی ڈیجیٹل حوالہ اور محفوظ کاپیاں کے ساتھ نیشنل آرکائیوز کو فراہم کرنے کے لیے CreateSpace کے ساتھ شراکت داری کو بھی طے کرتا ہے۔,نیشنل آرکائیوز نے اپنی یونیورسل نیوزریلز کو آن لائن دستیاب کرانے کے لیے کس کمپنی کے ساتھ تعاون کیا؟,اسپیس بنائیں,False
5a7ba69c21c2de001afea200,نیشنل_آرکائیوز_اور_ریکارڈز_انتظامیہ,&quot;مئی&quot; 2008 میں، نیشنل آرکائیوز نے منتخب دستاویزات کو ڈیجیٹائز کرنے کے لیے ایک پانچ سالہ انتظام کا انکشاف کیا، بشمول پورے امریکہ 1790--1930 سے وفاقی مردم شماری کا مجموعہ، 1820--1960 سے مسافروں کے اندراجات کے ساتھ ساتھ WWI اور WWII کے ڈرافٹ رجسٹریشن کارڈز تعاون کا یہ معاہدہ Ancestry.com کو 5 سال کی مدت کے لیے ڈیجیٹلائزڈ ریکارڈز تک خصوصی رسائی کی اجازت دیتا ہے، جس کے بعد ڈیجیٹل دستاویزات کو نیشنل آرکائیوز کے حوالے کر دیا جائے گا۔,WWI کے آغاز کی علامت کون سا مہینہ ہے؟,مئی,True
5a7baa9e21c2de001afea208,نیشنل_آرکائیوز_اور_ریکارڈز_انتظامیہ,"18 جون، 2009 کو، نیشنل آرکائیوز نے &quot;مقبول آرکائیو شدہ فلموں کی نمائش، ملک بھر میں آنے والے واقعات کے بارے میں عوام کو آگاہ کرنے&quot; اور نیشنل آرکائیوز کے ڈسپلے کو عوام کے سامنے لانے کے لیے ایک YouTube چینل کے آغاز کا اعلان کیا۔ مزید برآں، 2009 میں، نیشنل آرکائیوز نے اپنے فوٹو گرافی کے مجموعوں کے کچھ حصوں کو عام سامعین تک پھیلانے کے لیے فلکر فوٹو اسٹریم متعارف کرایا۔ دستاویزات کے ساتھ تدریس پر توجہ مرکوز کرنے والی ایک نئی سائٹ 2010 میں شروع کی گئی تھی اور اسے تعلیمی ٹیم نے بنایا تھا۔ اس ویب سائٹ میں آرکائیوز کے مجموعوں سے 3,000 دستاویزات، تصاویر اور ریکارڈنگ شامل ہیں۔ یہ کلاس روم کی نئی سرگرمیوں اور اسباق تیار کرنے کے لیے سبق کے منصوبے اور وسائل بھی فراہم کرتا ہے۔",2010 میں یوٹیوب چینل کے ابتدائی آغاز کی وجہ کیا تھی؟,مقبول محفوظ شدہ فلموں کی نمائش کے لیے، ملک بھر میں آنے والے واقعات کے بارے میں عوام کو آگاہ کرنا,True
56e78afc37bdd419002c40f7,ترستان_دا_کونہ,ابتدائی دیرپا نوآبادیاتی &quot;جوناتھن لیمبرٹ&quot; تھا، جس کا تعلق ریاستہائے متحدہ کے میساچوسٹس کے شہر سلیم سے تھا، جو دسمبر 1810 میں دو اضافی افراد کے ساتھ جزیروں پر پہنچا۔ لیمبرٹ نے عوامی طور پر ان جزائر کو اپنے طور پر اعلان کیا اور انہیں جزائر تازگی کا نام دیا اینڈریو ملیٹ کی آمد کے بعد، چار میں سے تین آدمی 1812 میں ہلاک ہو گئے۔ اس کے باوجود، مستقل آباد کاروں کی اصل تینوں میں سے واحد زندہ بچ جانے والا، تھامس کیوری (جسے ٹوماسو کوری بھی کہا جاتا ہے) جزیرے پر کاشتکار کے طور پر جاری رہا۔,پہلے مستقل باشندے کا نام کیا تھا؟,جوناتھن لیمبرٹ,False
5ad3c4e8604f3c001a3fefcd,ترستان_دا_کونہ,&quot;1816&quot; میں برطانوی سلطنت نے جزائر کا کنٹرول سنبھال لیا، جنوبی افریقہ کی کیپ کالونی سے ان پر حکومت کی۔ کہا جاتا ہے کہ یہ کارروائی بنیادی طور پر اس بات کی ضمانت دینے کی ایک پہل تھی کہ فرانسیسی سینٹ ہیلینا میں نپولین بوناپارٹ کو اس کی قید سے آزاد کرنے کے مشن کے لیے جزیروں کو اسٹیجنگ گراؤنڈ کے طور پر استعمال نہیں کر سکتے تھے۔ اس قبضے نے ریاستہائے متحدہ کو ٹرسٹان دا کونہ کو بحریہ کے اڈے کے طور پر استعمال کرنے سے بھی روک دیا، جیسا کہ اس نے 1812 کی جنگ کے دوران کیا تھا۔,کس سال برطانوی سلطنت نے جزائر پر قبضہ کیا؟,1816,True
5ad3d675604f3c001a3ff2fa,ترستان_دا_کونہ,"جزیرے کا گروپ خوشگوار درجہ حرارت کے ساتھ مرطوب سمندری آب و ہوا کا تجربہ کرتا ہے، اس کے ساتھ بار بار اعتدال پسند سے بھاری بارش ہوتی ہے اور جاری مغربی ہواؤں کی وجہ سے سورج کی روشنی بہت محدود ہوتی ہے۔ بارش کے دنوں کی مقدار کا موازنہ &quot;Aleutian جزائر&quot; سے کیا جا سکتا ہے، جو شمالی نصف کرہ میں نمایاں طور پر اونچے عرض بلد پر واقع ہیں، جبکہ سورج کی روشنی کے اوقات جوناؤ، الاسکا سے ملتے جلتے ہیں، جو خط استوا سے 20° زیادہ دور ہے۔ 500 میٹر (1,600 فٹ) کی بلندی سے نیچے ٹھنڈ نہیں پائی جاتی ہے، اور گرمیوں کا درجہ حرارت اتنا ہی معتدل ہوتا ہے، جو کبھی بھی 25 °C (77 °F) سے زیادہ نہیں ہوتا ہے۔ سینڈی پوائنٹ، جو مشرقی ساحل پر واقع ہے، کہا جاتا ہے کہ یہ جزیرے کا سب سے گرم اور خشک ترین علاقہ ہے، جو غالب ہواؤں سے محفوظ ہے۔",دھند کے دنوں کی تعداد کو کس سے تشبیہ دی جا سکتی ہے؟,Aleutian جزائر,True
5ad3de0b604f3c001a3ff457,ترستان_دا_کونہ,جزائر کی الگ تھلگ پوزیشن بیرونی دنیا میں نقل و حمل کو پیچیدہ بناتی ہے۔ ہوائی اڈے کے بغیر، جزائر تک رسائی صرف سمندر کے ذریعے حاصل کی جا سکتی ہے۔ جنوبی افریقہ سے ماہی گیری کے جہاز ہر سال تقریباً آٹھ یا نو بار جزائر کا دورہ کرتے ہیں۔ RMS سینٹ ہیلینا اپنے جنوری کے سفر کے دوران مرکزی جزیرے اور سینٹ ہیلینا کے ساتھ ساتھ جنوبی افریقہ کے درمیان ہر سال ایک بار رابطہ فراہم کرتا تھا، لیکن یہ تعلق حالیہ برسوں میں صرف دو بار ہوا ہے، خاص طور پر 2006 اور 2011 میں۔ وسیع تر علاقے میں ایسنشن آئی لینڈ کے ساتھ ہوائی سفر کے اختیارات ہیں جو RAF Ascension جزیرہ کے ذریعے فراہم کیے جا رہے ہیں، اور ایک نیا ہوائی اڈہ، جس کی مالی اعانت برطانیہ کی حکومت ہے، اس وقت سینٹ ہیلینا پر تعمیر کی جا رہی ہے، جس کی تکمیل 2016 میں متوقع ہے۔ تاہم، کسی بھی جگہ سے خود ٹرسٹان دا کونہا تک کوئی سیدھا، باقاعدہ راستہ باقی نہیں ہے۔ سات سمندروں کے ایڈنبرا کی بندرگاہ کو کالشوٹ ہاربر کہا جاتا ہے، جس کا نام ہیمپشائر کے اس مقام کے نام پر رکھا گیا ہے جہاں آتش فشاں پھٹنے کے دوران جزیرے کے رہائشی عارضی طور پر مقیم تھے۔,کالشوٹ ہاربر میں نئے ہوائی اڈے کے لیے فنڈنگ کس نے فراہم کی؟,برطانیہ کی حکومت,True
56e780ac00c9c71400d771c9,یونیورسٹی_آف_کنساس,یونیورسٹی آف کنساس (KU) ریاستی مالی اعانت سے چلنے والا ایک تحقیقی ادارہ ہے اور یہ امریکہ کا سب سے بڑا ادارہ ہے۔ کنساس کی ریاست KU سیٹلائٹ کیمپس لارنس، وچیٹا، اوورلینڈ پارک، سلینا، اور کنساس سٹی، کنساس کے شہروں میں واقع ہیں، جن کا بنیادی کیمپس لارنس میں &quot;ماؤنٹ اوریڈ&quot; پر پایا جاتا ہے، جو لارنس میں سب سے زیادہ بلندی پر ہے۔ 21 مارچ، 1865 کو قائم ہونے والی، یونیورسٹی نے 1866 میں کام شروع کیا، 1864 میں کنساس اسٹیٹ لیجسلیچر کی طرف سے دیے گئے چارٹر کے تحت، کنساس ریاست کے آئین کے تحت 1863 میں نافذ کردہ قانون سازی کے بعد، جسے 1864 میں 1866 میں منظور کیا گیا تھا۔ کنساس علاقہ بطور 1850 کی دہائی کے دوران بلیڈنگ کنساس کے نام سے مشہور اور پرتشدد داخلی سول تنازعہ کے بعد یونین میں 34 ویں ریاست۔,لارنس میں سب سے زیادہ بلندی کیا ہے؟,ماؤنٹ اوریڈ,False
56e7812637bdd419002c4050,یونیورسٹی_آف_کنساس,یونیورسٹی کا میڈیکل سنٹر اور یونیورسٹی ہسپتال کنساس &quot;&quot;Kansas City&quot; میں واقع ہیں۔ ایڈورڈز کیمپس کنساس سٹی میٹروپولیٹن علاقے کے اندر اوور لینڈ پارک، کنساس میں پایا جا سکتا ہے۔ مزید برآں، پارسنز اور ٹوپیکا میں تعلیمی اور تحقیقی سہولیات موجود ہیں، ساتھ ہی وکیٹا اور سلینا میں یونیورسٹی آف کنساس اسکول آف میڈیسن کی شاخیں ہیں۔ یہ ادارہ ایسوسی ایشن آف امریکن یونیورسٹیز کے 62 شرکاء میں سے ایک ہے۔,KU کا ہسپتال کس شہر میں ہے؟,کنساس سٹی,False
5acf4ae377cf76001a684b28,یونیورسٹی_آف_کنساس,"یونیورسٹی کے لیے جو مقام منتخب کیا گیا وہ ایک پہاڑی تھا جسے &quot;&quot;ماؤنٹ اوریڈ&quot; کہا جاتا ہے، جس کی ملکیت کنساس کے سابق گورنر چارلس ایل رابنسن کی تھی۔ رابنسن اور اس کی شریک حیات سارہ نے 40 ایکڑ (16 ہیکٹر) رقبہ ریاست کنساس کو دوسری جگہ جائیداد کے بدلے میں دیا۔ خیراتی فرد اموس ایڈمز لارنس نے ضروری انڈومنٹ فنڈ میں $10,000 کا حصہ ڈالا، جب کہ لارنس کے رہائشیوں نے گورنر کارنی کی طرف سے محفوظ کردہ نوٹ جاری کر کے بقیہ فنڈز جمع کیے۔ 2 نومبر، 1863 کو، گورنر کارنی نے اعلان کیا کہ لارنس نے ریاستی یونیورسٹی کے قیام کے لیے شرائط پوری کر دی ہیں، اور اگلے سال، یونیورسٹی کو باضابطہ طور پر تشکیل دیا گیا۔ اسکول کے بورڈ آف ریجنٹس نے مارچ 1865 میں اپنی پہلی میٹنگ کے لیے بلایا، یہ وہ تاریخ ہے جب KU اس کی بنیاد رکھتا ہے۔ کالج کی ابتدائی عمارت کی تعمیر اسی سال کے آخر میں شروع ہوئی۔ یونیورسٹی نے 12 ستمبر 1866 کو کلاسز کا آغاز کیا، 1873 میں فرسٹ کلاس گریجویشن کے ساتھ۔",KU کس قدرتی خصوصیت پر قائم ہوا؟,ماؤنٹ اوریڈ,True
56e786e700c9c71400d77241,یونیورسٹی_آف_کنساس,کنساس یونیورسٹی ایک ممتاز، سرکاری مالی اعانت سے چلنے والا ادارہ ہے، جس میں &quot;پانچ&quot; کیمپس شامل ہیں۔ KU میں کالج آف لبرل آرٹس اینڈ سائنسز شامل ہیں، جو اسکول آف دی آرٹس اور اسکول آف پبلک افیئرز اینڈ ایڈمنسٹریشن پر مشتمل ہے۔ آرکیٹیکچر، ڈیزائن اور منصوبہ بندی کے اداروں کے ساتھ ساتھ؛ کاروبار؛ تعلیم؛ انجینئرنگ صحت کے پیشے؛ صحافت اور ماس کمیونیکیشن؛ قانون; دوائی؛ موسیقی؛ نرسنگ؛ فارمیسی؛ اور سماجی بہبود یونیورسٹی 345 سے زیادہ ڈگری پروگرام مہیا کرتی ہے۔,KU کے زیر انتظام کیمپسز کی کل تعداد کتنی ہے؟,پانچ,False
56e7906100c9c71400d772d7,یونیورسٹی_آف_کنساس,کے یو کالج آف انجینئرنگ پرائمری کیمپس میں واقع ایک &quot;ABET&quot; سند یافتہ، عوامی انجینئرنگ ادارہ ہے۔ کالج آف انجینئرنگ باضابطہ طور پر 1891 میں قائم کیا گیا تھا، حالانکہ انجینئرنگ کی اہلیتیں 1873 کے اوائل میں دی گئی تھیں۔,مخفف ایک ایسی تنظیم کے لیے کیا نمائندگی کرتا ہے جو انجینئرنگ اداروں کے لیے ایک سندی ایجنسی کے طور پر کام کرتی ہے؟,ABET,False
5acf5df877cf76001a684c60,یونیورسٹی_آف_کنساس,ممتاز گریجویٹس میں شامل ہیں: ایلن موللی (BS/MS)، فورڈ موٹر کمپنی کے سابق صدر اور چیف ایگزیکٹو آفیسر، لو مونٹولی، نیٹ سکیپ کے شریک بانی اور Lynx ویب براؤزر کے خالق، &quot;&quot;Brian McClendon&quot;&quot; (BSEE 1986) ، گوگل میں انجینئرنگ کے نائب صدر، اور چارلس ای سپہر (1934)، جو اسٹینڈرڈ آئل کے سابق چیف ایگزیکٹو آفیسر ہیں۔ اوہائیو۔,کنساس یونیورسٹی میں پہلے گوگل کے کس عملے کے رکن نے پڑھایا تھا؟,برائن میک کلینڈن,True
5acf5f8077cf76001a684cb2,یونیورسٹی_آف_کنساس,KU میں ٹیوشن قومی اوسط سے 13 فیصد کم ہے، جیسا کہ کالج بورڈ نے رپورٹ کیا ہے، اور یونیورسٹی اس علاقے میں ایک &quot;عظیم قدر&quot; بنی ہوئی ہے۔[حوالہ درکار],وہ کون سی اصطلاح ہے جو KU میں فراہم کی جانے والی تعلیم کی قیمت کو اس کی قیمت کے لحاظ سے ظاہر کرتی ہے؟,بہترین خرید,True
56e7957600c9c71400d77304,یونیورسٹی_آف_کنساس,2007--2008 کے تعلیمی سال سے، KU میں پہلی بار داخل ہونے والوں سے 48 ماہ کے لیے کنساس بورڈ آف ریجنٹس کے ذریعہ اختیار کردہ چار سالہ ٹیوشن کمپیکٹ کے مطابق ٹیوشن کی مستقل شرح وصول کی جاتی ہے۔ 2014--15 تعلیمی سال کے دوران، ٹیوشن کی شرح اندرون ریاست تازہ ترین افراد کے لیے $318 فی کریڈٹ گھنٹہ اور ریاست سے باہر کے نئے افراد کے لیے &quot;$828&quot; تھی۔ ٹرانسفر طلبا کے لیے، جو کمپیکٹ میں شامل نہیں ہیں، 2014--15 فی کریڈٹ گھنٹے ٹیوشن اندرون ریاست انڈرگریجویٹس کے لیے $295 اور ریاست سے باہر انڈرگریجویٹس کے لیے $785 تھی۔ سالانہ اضافے سے مشروط۔ 6 یا اس سے زیادہ کریڈٹ اوقات کے لیے رجسٹرڈ طلباء نے $888 کی لازمی سالانہ کیمپس فیس بھی لی۔ فن تعمیر، موسیقی، فنون، کاروبار، تعلیم، انجینئرنگ، صحافت، قانون، فارمیسی اور سماجی بہبود کے اسکول اضافی فیسیں عائد کرتے ہیں۔,2014-15 تعلیمی سال میں کنساس سے باہر کے ایک طالب علم سے فی کریڈٹ گھنٹہ کتنی رقم وصول کی گئی؟,$828,False
5acf629377cf76001a684d0b,یونیورسٹی_آف_کنساس,شیہون زینجر کو جنوری 2011 میں KU کے لیے نئے ایتھلیٹک ڈائریکٹر کے طور پر پیش کیا گیا۔ سابقہ ایتھلیٹک ڈائریکٹر لیو پرکنز کے تحت، ڈیپارٹمنٹ کا مالیاتی منصوبہ 2003 میں $27.2 ملین (لیگ میں دسویں نمبر پر) سے اس وقت $50 ملین سے بڑھ گیا، جس کی بڑی وجہ فنڈز ہیں۔ ایلن فیلڈ ہاؤس میں سیٹنگ کے ایک نئے ترجیحی اقدام سے پیدا ہوا، جو کہ تازہ $26.67 ملین ایڈیڈاس کے ساتھ آٹھ سالہ معاہدہ نائکی کے ساتھ موجودہ معاہدے کی جگہ لے کر، اور ESPN ریجنل ٹیلی ویژن کے ساتھ 40.2 ملین ڈالر کا سات سالہ انتظام۔ اضافی مالی وسائل یونیورسٹی میں بہتری کا باعث بنے، جن میں شامل ہیں:,کونسا اسپورٹس ویئر برانڈ کا کنساس یونیورسٹی کے ساتھ کبھی معاہدہ نہیں ہوا؟,نائکی,True
56e79d9037bdd419002c4241,یونیورسٹی_آف_کنساس,مختلف مواقع جیسے گریجویشن اور تقریبات کے ساتھ ساتھ کھیلوں کی تقریبات میں اکثر پیش کی جانے والی اور گائی جانے والی مختلف دھنوں میں نمایاں ہیں: میں ایک جے ہاک، فائٹنگ جے ہاک، کنساس اینتھم، سن فلاور اینتھم، کرمسن اینڈ دی بلیو، ریڈ اینڈ بلیو ، راک چاک، جے ہاک کا نعرہ، ہوم آن دی رینج اور اسٹینڈ اپ اور خوش ہو جاؤ۔,کیا آپ دو گانوں کا نام دے سکتے ہیں جن کے عنوانات میں اسکول کی ٹیم کے رنگ شامل ہیں؟,کرمسن اینڈ دی بلیو، ریڈ اینڈ بلیو,False
5acf657877cf76001a684d52,کنساس_کی_یونیورسٹی,KU Endowment کی بنیاد 1891 میں ریاستہائے متحدہ میں پہلی فاؤنڈیشن کے طور پر رکھی گئی تھی جو ایک عوامی یونیورسٹی کے لیے وقف تھی۔ اس کا مقصد کنساس یونیورسٹی کو بڑھانے کے لیے &quot;&quot;خیراتی امداد&quot; فراہم کرنے میں خیراتی اداروں کے ساتھ تعاون کرنا ہے۔,کنساس یونیورسٹی سے فائدہ اٹھانے والوں کو کیا ملتا ہے؟,انسان دوستی کی حمایت,True
56e7839137bdd419002c4076,نانجنگ,آثار قدیمہ سے پتہ چلتا ہے کہ نانجنگ انسان 500 ہزار سال پہلے موجود تھا۔ Zun، شراب کے برتن کی ایک قسم، تقریباً 5000 سال قبل نانجنگ کی Beiyinyangying ثقافت میں موجود پایا گیا تھا۔ شانگ خاندان کے آخری مرحلے میں، ژاؤ کے تائیبو نے جیانگنان کا سفر کیا اور وو ریاست کی بنیاد رکھی، تاووو اور ہشو ثقافتوں کے نتائج پر مبنی بعض مورخین کے مطابق نانجنگ کا علاقہ ابتدائی مقام تھا۔ لیجنڈ کے مطابق، وو ریاست کے بادشاہ، فوچائی نے 495 قبل مسیح میں موجودہ نانجنگ علاقے میں یچینگ (冶城) کے نام سے ایک مضبوط قلعہ تعمیر کیا۔  اس کے بعد، 473 قبل مسیح میں، یو کی ریاست نے وو کو شکست دی اور آج کے Zhonghua گیٹ کے اطراف میں Yuecheng (越城) کا قلعہ قائم کیا۔ 333 قبل مسیح میں، یو کی ریاست کا تختہ الٹنے کے بعد، ریاست چو نے موجودہ نانجنگ کے مغرب میں جنلنگ یی (金陵邑) کی بنیاد رکھی۔ بعد میں کن شی ہوانگ کے دور حکومت میں اس کا نام مولنگ (秣陵) رکھ دیا گیا۔ اس وقت سے، یہ شہر تباہی اور تجدید کے متعدد دوروں سے گزر چکا ہے۔ ہان خاندان کے دوران یوان فینگ کے 5 ویں سال میں ملک کے 13 نگران اور انتظامی ڈویژنوں میں سے ایک کے طور پر قائم کیا گیا (106 قبل مسیح)۔ نانجنگ دانیانگ پریفیکچر کا دارالحکومت بن گیا اور ہان کے اواخر سے تانگ کے ابتدائی ادوار تک تقریباً 400 سال تک یانگ زو کا دارالحکومت رہا۔,نانجنگ کتنے سالوں تک یانگ زو کا دارالحکومت تھا؟,تقریبا 400 سال,False
